Search,Cost,Clicks,Impressions,Conversions
kings auto fort collins,$129.07,78,315,0.00
kings auto,$89.59,43,213,0.00
kings auto center fort collins,$68.01,37,134,0.00
kings auto center,$62.74,25,130,0.00
subaru fort collins,$44.07,5,65,0.00
total automotive fort collins,$28.00,3,60,0.00
kings automotive,$20.23,10,48,0.00
subaru service fort collins,$46.30,3,46,0.00
mechanic near me,$0.00,0,39,0.00
fort collins auto repair,$14.01,1,34,0.00
subaru,$31.15,1,34,0.00
subaru repair fort collins,$5.73,1,28,0.00
king's auto center fort collins,$19.58,5,27,0.00
pine dog automotive fort collins,$18.22,1,26,0.00
small engine repair fort collins,$2.52,1,25,0.00
mechanic fort collins,$21.31,1,24,0.00
king auto fort collins,$25.55,6,23,0.00
car repair fort collins,$0.00,0,22,0.00
kia fort collins service,$0.00,0,22,0.00
subaru mechanic fort collins,$3.57,1,22,0.00
super rupair,$11.63,1,22,0.00
auto repair experts fort collins,$7.01,1,20,0.00
king's auto center,$2.36,3,20,0.00
mechanics near me,$0.00,0,20,0.00
fort collins nissan service,$0.00,0,19,0.00
king's auto,$3.15,2,19,0.00
auto repair near me,$0.00,0,18,0.00
subaru mechanic near me,$40.04,4,18,0.00
auto shop near me,$0.00,0,17,0.00
asr fort collins,$40.01,1,16,0.00
kings auto repair fort collins,$6.97,4,16,0.00
dave's automotive fort collins,$0.00,0,15,0.00
subaru service,$0.00,0,15,0.00
toyota service fort collins,$0.00,0,15,0.00
oil change fort collins,$12.67,2,14,0.00
subaru service near me,$0.00,0,14,0.00
european motors fort collins,$0.00,0,13,0.00
best auto repair fort collins,$7.53,1,12,0.00
fort collins kia service,$0.00,0,12,0.00
mechanics in fort collins,$49.12,1,12,0.00
auto shops near me,$0.00,0,11,0.00
fort collins subaru,$12.69,2,11,0.00
king's auto fort collins,$2.51,2,11,0.00
subaru fort collins service,$6.24,1,11,0.00
westin automotive fort collins,$10.41,2,11,0.00
auto shop fort collins,$0.00,0,10,0.00
auto shops fort collins,$0.00,0,10,0.00
car repair near me,$0.00,0,10,0.00
nissan fort collins service,$0.00,0,10,0.00
mechanics fort collins,$0.00,0,9,0.00
1up complete auto care,$0.00,0,8,0.00
ams fort collins,$0.00,0,8,0.00
auto mechanic fort collins,$7.09,1,8,0.00
final drive fort collins,$23.15,1,8,0.00
fort collins mechanics,$0.00,0,8,0.00
kia service center,$0.00,0,8,0.00
kia service fort collins,$7.19,1,8,0.00
kings automotive fort collins,$0.55,1,8,0.00
nelson auto fort collins,$5.55,1,8,0.00
tune up near me,$0.00,0,8,0.00
weston auto fort collins,$0.00,0,8,0.00
alignment fort collins,$0.00,0,7,0.00
pat's vee w unlimited,$0.00,0,7,0.00
auto repair fort collins,$0.00,0,6,0.00
auto repair shop,$0.00,0,6,0.00
automotive shops near me,$0.00,0,6,0.00
autonation subaru arapahoe,$0.00,0,6,0.00
caliber fort collins,$0.00,0,6,0.00
car mechanic near me,$0.00,0,6,0.00
fast track auto repair fort collins,$0.00,0,6,0.00
longs auto center,$22.91,1,6,0.00
nissan service fort collins,$0.00,0,6,0.00
subaru maintenance,$0.00,0,6,0.00
subaru mechanic,$0.00,0,6,0.00
subaru repair,$0.00,0,6,0.00
the motorway fort collins,$0.00,0,6,0.00
a&b auto fort collins,$0.00,0,5,0.00
car mechanic fort collins,$0.00,0,5,0.00
electrical car mechanics,$0.00,0,5,0.00
european motor cars fort collins,$0.00,0,5,0.00
fort collins kia service department,$0.00,0,5,0.00
fort collins mechanic,$0.00,0,5,0.00
fort collins subaru service,$11.15,1,5,0.00
honda auto repair fort collins,$0.00,0,5,0.00
honda service fort collins,$4.86,1,5,0.00
jeep service fort collins,$0.00,0,5,0.00
oil change near me,$0.00,0,5,0.00
subaru express service,$0.00,0,5,0.00
subaru fort collins colorado,$20.73,1,5,0.00
subaru repair near me,$0.00,0,5,0.00
subaru shop,$0.00,0,5,0.00
subaru shop near me,$24.57,1,5,0.00
transmission repair fort collins,$0.00,0,5,0.00
volvo service fort collins,$5.34,1,5,0.00
we care auto repair fort collins,$0.00,0,5,0.00
accurate auto,$0.00,0,4,0.00
audi service fort collins,$0.00,0,4,0.00
auto shop open on saturday,$0.00,0,4,0.00
automotive repair fort collins,$0.00,0,4,0.00
best mechanic fort collins,$15.14,1,4,0.00
